{
	"$schema": "../schema.json",

	"name": "Pack sanity check",
	"description": "Verify thermistor response",

	"tx": [
		{
			"timestamp": 2000,
			"msg_name": "pack_analog",
			"signals": {
				"pack_voltage": 540.0,
				"pack_current": 10.0
			}
		},

		{
			"timestamp": 10000,
			"msg_name": "thermistor_telemetry",
			"signals": {
				"temperature": 35.0,
				"module_num": 1,
    			"thermistor_num": 2
			}
		},

		{
			"msg_name": "canpiler_test",
			"timestamp": 3000,
			"signals": {
				"temperature": 25,
				"current": 10,
				"voltage": 3.3,
				"pressure": 100,
				"status": 1
			}
		}
	],
	"expect": [
		{
			"window": [10000, 10120],
			"msg_name": "thermistor_telemetry",
			"signals": {
				"temperature": [30.0, 40.0]
			}
		}
	]
}